title,score,author,time,source
Atlanta man gets life sentence for rape after victim recognizes him at train station six years later,19.7k,Ramy_,Tue Sep 18 20:42:33 2018 UTC,foxnews.com
"'Highly probable' Pussy Riot activist was poisoned, say German doctors | World news",5169,throwawaysobehonest,Tue Sep 18 12:18:19 2018 UTC,theguardian.com
Michael Jordan donates $2 million for Florence relief and recovery aid,409,ani625,Wed Sep 19 00:47:37 2018 UTC,edition.cnn.com
Dallas officer Amber Guyger moves out of apartment complex where she killed Botham Jean,1791,OfficialHermanCain,Tue Sep 18 16:31:24 2018 UTC,fox4news.com
Rice University announces free tuition for middle income undergraduate students,4726,jwil191,Tue Sep 18 11:53:12 2018 UTC,chron.com
McDonald's workers walk out in 10 US cities over 'sexual harassment epidemic',16.6k,newnemo,Tue Sep 18 08:34:09 2018 UTC,theguardian.com
Ex-Oklahoma state senator sentenced to 15 years on child sex trafficking charge,402,hopopo,Tue Sep 18 22:02:43 2018 UTC,nbcnews.com
Sidewalk vending is decriminalized across California,808,dagst3r,Tue Sep 18 17:26:33 2018 UTC,ocregister.com
The Kavanaugh vote has officially been canceled,444,EnigmaTrain,Tue Sep 18 20:30:35 2018 UTC,cnn.com
Apple pays $15 Billion EU 'fine' over illegal tax deal with Ireland.,228,URZ_,Tue Sep 18 23:19:53 2018 UTC,reuters.com
"Champion golfer found murdered on course, suspect charged",2077,LioydJour,Tue Sep 18 10:18:55 2018 UTC,abcnews.go.com
Tesla stock drops after company reportedly to face US criminal probe over Musk statements,687,BadDrvrsofSac,Tue Sep 18 15:51:36 2018 UTC,cnbc.com
Kim Jong Un hugs South Korean leader in Pyongyang ahead of historic summit,997,TraditionalIntet,Tue Sep 18 13:52:42 2018 UTC,news.sky.com
"'We did it for kicks' Armed robbers as young as 11 years old prey on Houston residents, including elderly, officials say",592,gottagroove,Tue Sep 18 16:22:59 2018 UTC,abc13.com
Navy Chief found dead in her Jacksonville home filed for protective order two weeks ago.,49.9k,nicksatdown,Tue Sep 18 01:34:03 2018 UTC,firstcoastnews.com
"Woolly Mammoths will roam new Jurassic Park-style theme park with cave lions and extinct horses in ten years, Russian scientists say",513,Acesolid,Tue Sep 18 15:29:49 2018 UTC,foxnews.com
"100,000-year old archeology site discovered in Riyadh",169,SerArthurDaynk,Tue Sep 18 21:26:35 2018 UTC,m.gulfnews.com
Man sentenced to century in prison in Pennsylvania's largest case of child porn,147,Theholepatrol,Tue Sep 18 22:14:09 2018 UTC,edmontonsun.com
Lawyer for Ultranationalist ‘Proud Boys’ Arrested For Allegedly Faking Gun Theft,•,ani625,Wed Sep 19 01:02:38 2018 UTC,thedailybeast.com
US police 'using Tiger Text app to conceal evidence',356,rytis,Tue Sep 18 16:39:20 2018 UTC,aljazeera.com
"Guy caught on video in sex act at a Hoboken bar is a cop, attorney says",304,da_new_acct,Tue Sep 18 16:54:31 2018 UTC,nj1015.com
US couple suspected of multiple drug rapes,114,caussyn,Tue Sep 18 21:24:58 2018 UTC,bbc.com
Bowie High students claim discrimination over 'religious' parking spots,99,Echoes_of_Screams,Tue Sep 18 21:27:26 2018 UTC,kxan.com
Gun goes off inside Mormon meetinghouse in Provo; church leader is recorded urging teenage girls not to spread news on social media,7894,RyanRebalkin,Mon Sep 17 23:33:52 2018 UTC,sltrib.com
Minecraft DDoS'ers sentenced to serve the FBI's cybersecurity division.,182,TheLeftCantMeme_,Tue Sep 18 17:44:56 2018 UTC,wired.com
